[
  {
    "title": "AI vs VFX: Can Seedance 2.5 Beat VFX?",
    "source": "Higgsfield Blog",
    "url": "https://higgsfield.ai/blog/ai-vs-vfx",
    "published_at": "2026-08-07",
    "captured_date": "2026-08-08",
    "content_types": ["工作流", "角色一致性", "教程"],
    "stages": ["Storyboard", "Keyframe", "Higgsfield", "Review"],
    "credibility": "高",
    "summary": "用官方对比场景拆解 Seedance 2.5 在尺度、质感和镜头控制上的优势与边界。",
    "template": "用尺寸参照和合成逻辑先锁空间关系，再判断生成链是否值得替代传统 VFX。",
    "ability_links": ["size_ref_scale_lock"],
    "evidence_boundary": "官方公开方法页；不等于全面替代 VFX 的独立第三方验证。"
  },
  {
    "title": "Bring Silent Videos to Life: Foley LoRA For LTX-2.3",
    "source": "LTX Blog",
    "url": "https://ltx.io/blog/bring-silent-videos-to-life-foley-lora",
    "published_at": "2026-08-04",
    "captured_date": "2026-08-08",
    "content_types": ["工作流", "音频驱动", "教程"],
    "stages": ["Storyboard", "Higgsfield", "Delivery"],
    "credibility": "高",
    "summary": "把静音镜头补出动作相关的 Foley 质感，重点不在音乐而在动作与材质绑定。",
    "template": "先定义动作与接触材质，再为镜头补足对应的声音纹理。",
    "ability_links": ["foley_action_material_prompt"],
    "evidence_boundary": "官方公开教程；以方法和参数结构为证据，不是独立审片结论。"
  },
  {
    "title": "Remove People and Shadows from Video: Clean Plate LoRA",
    "source": "LTX Blog",
    "url": "https://ltx.io/blog/remove-people-and-shadows-from-video",
    "published_at": "2026-08-03",
    "captured_date": "2026-08-08",
    "content_types": ["工作流", "质检/返工", "教程"],
    "stages": ["Storyboard", "Review", "Delivery"],
    "credibility": "高",
    "summary": "把干净底板作为目标，而不是把移除行人理解为普通修图任务。",
    "template": "定义 clean plate 目标、禁留残影和阴影规则，再做局部处理。",
    "ability_links": ["clean_plate_negative_pack"],
    "evidence_boundary": "官方公开教程；主要证明返工方法，不证明所有场景都稳定。"
  },
  {
    "title": "Relight Exterior Footage to Any Sun Direction: Relight IC-LoRA For LTX-2.3",
    "source": "LTX Blog",
    "url": "https://ltx.io/blog/relight-exterior-footage-to-any-sun-direction",
    "published_at": "2026-08-02",
    "captured_date": "2026-08-08",
    "content_types": ["工作流", "运镜", "教程"],
    "stages": ["Keyframe", "Review", "Delivery"],
    "credibility": "高",
    "summary": "通过固定光向与受光逻辑，做更稳定的单次重打光。",
    "template": "先定义主光方向和角色受光，再做统一 relight pass。",
    "ability_links": ["light_direction_ball_relight"],
    "evidence_boundary": "官方公开教程；更多是光线与后期控制证据。"
  },
  {
    "title": "How to Turn a Photo Into an AI Video: Step-by-Step Guide (2026)",
    "source": "Higgsfield Blog",
    "url": "https://higgsfield.ai/blog/photo-to-ai-video",
    "published_at": "2026-08-04",
    "captured_date": "2026-08-08",
    "content_types": ["工作流", "教程"],
    "stages": ["Storyboard", "Keyframe", "Higgsfield"],
    "credibility": "中高",
    "summary": "从单图入手生成视频，核心在首帧和动作方向的结构化约束。",
    "template": "先锁首帧，再描述动作方向和结束状态。",
    "ability_links": [],
    "evidence_boundary": "主要依据公开页面元数据和 FAQ；正文提取可靠性弱于其他案例。"
  },
  {
    "title": "How to Keep the Same AI Voice Across Every Video: Consistent AI Audio Explained",
    "source": "Higgsfield Blog",
    "url": "https://higgsfield.ai/blog/consistent-ai-voice-across-videos",
    "published_at": "2026-08-07",
    "captured_date": "2026-08-08",
    "content_types": ["工作流", "音频驱动", "教程"],
    "stages": ["Producer", "Higgsfield", "Review", "Delivery"],
    "credibility": "高",
    "summary": "把声音一致性拆成 source、config、速度/音高/音量、情绪与 delivery 四个稳定维度。",
    "template": "统一 voice source，保存完整 config，后续 clip 只复用，不手动漂移。",
    "ability_links": ["voice_anchor_config_lock"],
    "evidence_boundary": "官方公开方法页；重点是音频一致性，不提供完整成片镜头审美证据。"
  },
  {
    "title": "Seedance 2.5 on Higgsfield in 2026: What You Get and How It Works",
    "source": "Higgsfield Blog",
    "url": "https://higgsfield.ai/blog/seedance-2-5-on-higgsfield-2026",
    "published_at": "2026-08-06",
    "captured_date": "2026-08-08",
    "content_types": ["工作流", "运镜", "角色一致性", "音频驱动", "教程"],
    "stages": ["Producer", "Storyboard", "Keyframe", "Higgsfield", "Review"],
    "credibility": "高",
    "summary": "把时代、类型、光线、镜头、物理、情绪等控制从纯 Prompt 提升为 selector-first 的显式控制面。",
    "template": "references 先行，selector 锁控制面，prompt 只写动作和事件，再做局部修补。",
    "ability_links": ["selector_before_prompt_lock"],
    "evidence_boundary": "官方公开方法页；发布时间略超严格 24 小时窗口，但方法透明度高。"
  },
  {
    "title": "Seedance 2.5 in Runway API",
    "source": "Runway Dev Changelog",
    "url": "https://docs.dev.runwayml.com/api-details/api_changelog/#seedance-25-in-runway-api",
    "published_at": "2026-08-07",
    "captured_date": "2026-08-08",
    "content_types": ["工具更新", "工作流", "音频驱动"],
    "stages": ["Producer", "Storyboard", "Review"],
    "credibility": "高",
    "summary": "公开了 30 图、10 视频、10 音频的 reference budget，以及 4 到 30 秒的输入输出规则。",
    "template": "reference 足够时可省略 promptText，优先组装多模态 shot package。",
    "ability_links": [],
    "evidence_boundary": "官方 API changelog，证明参数与约束，不证明成片质量。"
  },
  {
    "title": "Hailuo 3.0 in Runway API",
    "source": "Runway Dev Changelog",
    "url": "https://docs.dev.runwayml.com/api-details/api_changelog/#hailuo-30-in-runway-api",
    "published_at": "2026-08-05",
    "captured_date": "2026-08-08",
    "content_types": ["工具更新", "工作流", "运镜", "音频驱动"],
    "stages": ["Producer", "Storyboard", "Keyframe"],
    "credibility": "高",
    "summary": "公开支持 keyframe control 和多类型参考素材，说明长动作或过渡镜头可显式关键帧化。",
    "template": "先拆关键帧，再决定 text/image/video-to-video 入口。",
    "ability_links": [],
    "evidence_boundary": "官方 API changelog，重点是接口能力，不是完整案例展示。"
  },
  {
    "title": "Grok Imagine Video 1.5 in Runway API",
    "source": "Runway Dev Changelog",
    "url": "https://docs.dev.runwayml.com/api-details/api_changelog/#grok-imagine-video-15-in-runway-api",
    "published_at": "2026-08-07",
    "captured_date": "2026-08-08",
    "content_types": ["工具更新", "工作流", "角色一致性", "音频驱动"],
    "stages": ["Producer", "Storyboard", "Keyframe", "Review"],
    "credibility": "高",
    "summary": "公开了图像参考与音频参考同时存在时的规格约束，强调 refs 和分辨率之间的取舍。",
    "template": "至少一张 anchor image，再挂 audio refs；若要 refs，就接受 720p 上限。",
    "ability_links": [],
    "evidence_boundary": "官方 API changelog，重点是路由规则与限制，不是镜头美学案例。"
  }
]
